<?xml version="1.0" encoding="LATIN1" ?>
<!DOCTYPE metamodulelist  SYSTEM "http://flowvr.sf.net/flowvr-parse/dtd/metamodulelist.dtd">
<metamodulelist>
    <metamodule id="Visu">
      <metamoduledescription>flowvr-renderer.desc.xml</metamoduledescription>
	<template id="args">--white</template>
        <host>localhost</host>
        <run />
        <modulelist />
    </metamodule>
    <metamodule id="Vtk">
      <metamoduledescription>vtk.desc.xml</metamoduledescription>
	<template id="script">$FLOWVR_PWD/modules/warpComb.tcl</template>
        <host>localhost</host>
        <run />
        <modulelist />
    </metamodule>
</metamodulelist>
